{
  "version": 3,
  "scope": "target",
  "title": "Поиск по каталогу",
  "entry": "portal",
  "nodes": [
    {
      "key": "portal",
      "title": "Интерфейс поиска",
      "summary": "Принимает запрос и показывает найденные записи.",
      "kind": "component",
      "zone": "presentation",
      "rules": [
        {
          "title": "Пустой запрос",
          "text": "Пустой запрос не запускает поиск."
        }
      ],
      "detail": "boundary",
      "detailNote": "В этом примере компоненты экрана не раскрываются.",
      "implemented": false
    },
    {
      "key": "search",
      "title": "Поиск",
      "summary": "Проверяет запрос, находит записи и возвращает упорядоченный результат.",
      "kind": "subsystem",
      "zone": "application",
      "rules": [],
      "detail": "mapped",
      "implemented": false,
      "children": [
        {
          "key": "gateway",
          "title": "Обработка запросов",
          "summary": "Проверяет параметры, передаёт запрос вычислению и формирует ответ.",
          "kind": "component",
          "zone": "application",
          "rules": [
            {
              "title": "Ограничение выдачи",
              "text": "Число возвращаемых записей ограничено параметром запроса."
            }
          ],
          "detail": "boundary",
          "detailNote": "Протокол транспорта не уточняется в примере.",
          "implemented": false
        },
        {
          "key": "engine",
          "title": "Поисковое вычисление",
          "summary": "Получает кандидатов из индекса и ранжирует их по запросу.",
          "kind": "subsystem",
          "zone": "application",
          "rules": [],
          "detail": "mapped",
          "implemented": false,
          "children": [
            {
              "key": "query",
              "title": "Получение кандидатов",
              "summary": "Запрашивает подходящие записи каталога и передаёт их ранжированию.",
              "kind": "component",
              "zone": "application",
              "rules": [],
              "detail": "boundary",
              "detailNote": "Конкретный язык запросов к индексу не выбран.",
              "implemented": false
            },
            {
              "key": "ranking",
              "title": "Ранжирование",
              "summary": "Вычисляет порядок кандидатов по тексту и параметрам запроса.",
              "kind": "component",
              "zone": "pure",
              "rules": [
                {
                  "title": "Одинаковые оценки",
                  "text": "При равных оценках сохраняется определённый порядок по ключу записи."
                }
              ],
              "detail": "boundary",
              "detailNote": "Внутренняя формула оценки находится за границей примера.",
              "implemented": false
            }
          ]
        }
      ]
    },
    {
      "key": "archive",
      "title": "Индекс каталога",
      "summary": "Сохраняет опубликованные записи и отдаёт кандидатов по запросу.",
      "kind": "store",
      "zone": "infrastructure",
      "rules": [],
      "detail": "boundary",
      "detailNote": "Конкретная технология хранения не выбрана.",
      "implemented": false
    },
    {
      "key": "publisher",
      "title": "Поставщик каталога",
      "summary": "Публикует подготовленные записи в индекс через согласованный интерфейс записи.",
      "kind": "external",
      "zone": "external",
      "rules": [],
      "detail": "boundary",
      "detailNote": "Внешняя система описана только в пределах публикации записей.",
      "implemented": false
    }
  ],
  "relations": [
    {
      "key": "search-command",
      "from": "portal",
      "to": "gateway",
      "kind": "command",
      "channel": "search",
      "label": "Найти записи",
      "payload": "Текст запроса, фильтры и предел числа результатов.",
      "meaning": "Владелец инициирует поиск через интерфейс.",
      "implemented": false
    },
    {
      "key": "query-input",
      "from": "gateway",
      "to": "query",
      "kind": "data",
      "channel": "request-input",
      "label": "Проверенный запрос",
      "payload": "Нормализованный текст и фильтры отбора кандидатов.",
      "meaning": "Получение кандидатов использует проверенные параметры запроса.",
      "implemented": false
    },
    {
      "key": "ranking-input",
      "from": "gateway",
      "to": "ranking",
      "kind": "data",
      "channel": "request-input",
      "label": "Проверенный запрос",
      "payload": "Нормализованный текст и параметры сортировки.",
      "meaning": "Ранжирование использует контекст того же запроса.",
      "implemented": false
    },
    {
      "key": "lookup",
      "from": "query",
      "to": "archive",
      "kind": "command",
      "channel": "lookup",
      "label": "Отбор записей",
      "payload": "Критерии поиска и максимальный размер набора кандидатов.",
      "meaning": "Компонент запрашивает кандидатов из индекса.",
      "implemented": false
    },
    {
      "key": "candidates",
      "from": "archive",
      "to": "query",
      "kind": "data",
      "channel": "candidates",
      "label": "Кандидаты",
      "payload": "Записи, соответствующие критериям отбора.",
      "meaning": "Индекс возвращает найденные записи для дальнейшей обработки.",
      "implemented": false
    },
    {
      "key": "rank-candidates",
      "from": "query",
      "to": "ranking",
      "kind": "data",
      "channel": "ranking",
      "label": "Записи для оценки",
      "payload": "Кандидаты и их доступные признаки.",
      "meaning": "Кандидаты передаются вычислению порядка выдачи.",
      "implemented": false
    },
    {
      "key": "ranked",
      "from": "ranking",
      "to": "gateway",
      "kind": "data",
      "channel": "ranked",
      "label": "Упорядоченные записи",
      "payload": "Ключи записей и их оценки в порядке выдачи.",
      "meaning": "Обработчик получает результат вычисления и формирует ответ.",
      "implemented": false
    },
    {
      "key": "response",
      "from": "gateway",
      "to": "portal",
      "kind": "data",
      "channel": "response",
      "label": "Результат поиска",
      "payload": "Ограниченный список найденных записей с данными для отображения.",
      "meaning": "Интерфейс показывает результат запроса.",
      "implemented": false
    },
    {
      "key": "publish",
      "from": "publisher",
      "to": "archive",
      "kind": "data",
      "channel": "publication",
      "label": "Записи каталога",
      "payload": "Подготовленные записи с устойчивыми ключами.",
      "meaning": "Поставщик обновляет содержимое индекса через интерфейс записи.",
      "implemented": false
    },
    {
      "key": "publication-result",
      "from": "archive",
      "to": "publisher",
      "kind": "state",
      "channel": "publication-result",
      "label": "Состояние публикации",
      "payload": "Идентификатор принятой публикации или явный отказ.",
      "meaning": "Поставщик узнаёт, принят ли переданный набор записей.",
      "implemented": false
    }
  ]
}
